{
  "run_number": 1,
  "exit_code": 0,
  "token_stats": {
    "input_tokens": 23,
    "output_tokens": 725,
    "cache_creation_tokens": 23556,
    "cache_read_tokens": 91828
  },
  "tokens_input": 91851,
  "tokens_output": 725,
  "cost_usd": 0.1684904,
  "duration_seconds": 178.209039,
  "agent_duration_seconds": 41.174623,
  "judge_duration_seconds": 137.034416,
  "judge_score": 0.9595333333333333,
  "judge_passed": true,
  "judge_grade": "A",
  "judge_reasoning": "The agent successfully created a minimal, correct Hello World script that meets all functional requirements. The single-line implementation is appropriately scoped and idiomatic Python. Minor deduction for cache artifacts (.ruff_cache, .pytest_cache) remaining in workspace, though these are typically gitignored and were created by the build pipeline rather than the agent.",
  "judges": [
    {
      "model": "claude-opus-4-5-20251101",
      "score": 0.95,
      "passed": true,
      "grade": "A",
      "reasoning": "The agent successfully created a minimal, correct Hello World script that meets all functional requirements. The single-line implementation is appropriately scoped and idiomatic Python. Minor deduction for cache artifacts (.ruff_cache, .pytest_cache) remaining in workspace, though these are typically gitignored and were created by the build pipeline rather than the agent.",
      "judge_number": 1
    },
    {
      "model": "claude-sonnet-4-5-20250929",
      "score": 1.0,
      "passed": true,
      "grade": "S",
      "reasoning": "The agent delivered a perfect Hello World implementation: exactly one line of code, correct output, clean workspace with no build artifacts. The solution demonstrates exceptional restraint and appropriateness for this trivial task, avoiding over-engineering while meeting all requirements. This is a textbook example of proportional engineering.",
      "judge_number": 2
    },
    {
      "model": "claude-haiku-4-5",
      "score": 0.9286,
      "passed": true,
      "grade": "A",
      "reasoning": "The agent successfully created a perfectly minimal and idiomatic Hello World script that passes all functional requirements and code quality checks. The script produces exactly the required output with proper exit code. However, a deduction was applied for failing to clean up build artifacts (.pytest_cache and .ruff_cache directories) as explicitly required in the cleanup requirements of CLAUDE.md, preventing a perfect score.",
      "judge_number": 3
    }
  ],
  "workspace_path": "/home/mvillmow/fullruns/test001-dryrun/2026-01-20T06-13-07-test-001/T4/01/run_01/workspace",
  "logs_path": "/home/mvillmow/fullruns/test001-dryrun/2026-01-20T06-13-07-test-001/T4/01/run_01/agent",
  "command_log_path": "/home/mvillmow/fullruns/test001-dryrun/2026-01-20T06-13-07-test-001/T4/01/run_01/agent/command_log.json",
  "criteria_scores": {}
}
