{
  "run_number": 1,
  "exit_code": 0,
  "token_stats": {
    "input_tokens": 26,
    "output_tokens": 625,
    "cache_creation_tokens": 4629,
    "cache_read_tokens": 109368
  },
  "tokens_input": 109394,
  "tokens_output": 625,
  "cost_usd": 0.06531415,
  "duration_seconds": 153.130363,
  "agent_duration_seconds": 24.755993,
  "judge_duration_seconds": 128.37437,
  "judge_score": 0.9833333333333334,
  "judge_passed": true,
  "judge_grade": "A",
  "judge_reasoning": "The agent successfully created a minimal, idiomatic hello.py script that produces the exact expected output with exit code 0. The implementation is appropriately simple (single line of code) and follows Python best practices. Minor deduction for .ruff_cache and .pytest_cache directories remaining in workspace, though these are generated by the build pipeline rather than the agent directly.",
  "judges": [
    {
      "model": "claude-opus-4-5-20251101",
      "score": 0.95,
      "passed": true,
      "grade": "A",
      "reasoning": "The agent successfully created a minimal, idiomatic hello.py script that produces the exact expected output with exit code 0. The implementation is appropriately simple (single line of code) and follows Python best practices. Minor deduction for .ruff_cache and .pytest_cache directories remaining in workspace, though these are generated by the build pipeline rather than the agent directly.",
      "judge_number": 1
    },
    {
      "model": "claude-sonnet-4-5-20250929",
      "score": 1.0,
      "passed": true,
      "grade": "S",
      "reasoning": "The agent delivered a textbook-perfect Hello World implementation: a single print statement with no over-engineering, all functional requirements met, and all quality checks passed. The solution demonstrates appropriate scoping and professional simplicity, exactly what a senior engineer would approve for this trivial task.",
      "judge_number": 2
    },
    {
      "model": "claude-haiku-4-5",
      "score": 1.0,
      "passed": true,
      "grade": "S",
      "reasoning": "The agent successfully completed the task with perfect execution across all criteria. The solution is maximally simple and idiomatic, with clean code that passes all checks (syntax, format, execution). All functional requirements met: file created, exact output produced, exit code 0, and no unnecessary artifacts or files.",
      "judge_number": 3
    }
  ],
  "workspace_path": "/home/mvillmow/fullruns/test001-dryrun/2026-01-20T06-13-07-test-001/T5/01/run_01/workspace",
  "logs_path": "/home/mvillmow/fullruns/test001-dryrun/2026-01-20T06-13-07-test-001/T5/01/run_01/agent",
  "command_log_path": "/home/mvillmow/fullruns/test001-dryrun/2026-01-20T06-13-07-test-001/T5/01/run_01/agent/command_log.json",
  "criteria_scores": {}
}
