{
  "run_number": 1,
  "exit_code": 0,
  "token_stats": {
    "input_tokens": 25,
    "output_tokens": 668,
    "cache_creation_tokens": 23352,
    "cache_read_tokens": 91771
  },
  "tokens_input": 91796,
  "tokens_output": 668,
  "cost_usd": 0.1294133,
  "duration_seconds": 179.002418,
  "agent_duration_seconds": 29.9015,
  "judge_duration_seconds": 149.100918,
  "judge_score": 0.9833333333333334,
  "judge_passed": true,
  "judge_grade": "A",
  "judge_reasoning": "The agent successfully created a simple, idiomatic hello.py script that meets all functional requirements. The script prints exactly 'Hello, World!' and exits with code 0. The implementation is appropriately minimal (3 lines) with no over-engineering. Minor deduction for .ruff_cache and .pytest_cache remaining in workspace, though these are build pipeline artifacts rather than agent-created files.",
  "judges": [
    {
      "model": "claude-opus-4-5-20251101",
      "score": 0.96,
      "passed": true,
      "grade": "A",
      "reasoning": "The agent successfully created a simple, idiomatic hello.py script that meets all functional requirements. The script prints exactly 'Hello, World!' and exits with code 0. The implementation is appropriately minimal (3 lines) with no over-engineering. Minor deduction for .ruff_cache and .pytest_cache remaining in workspace, though these are build pipeline artifacts rather than agent-created files.",
      "judge_number": 1
    },
    {
      "model": "claude-sonnet-4-5-20250929",
      "score": 1.0,
      "passed": true,
      "grade": "S",
      "reasoning": "The agent delivered a perfect Hello World implementation. The solution is appropriately minimal (4 lines with shebang, idiomatic Python using a simple print statement), meets all functional requirements exactly, passes all build/format checks, and demonstrates excellent engineering judgment by not over-engineering a trivial task. The inclusion of a proper shebang line shows attention to best practices without adding unnecessary complexity.",
      "judge_number": 2
    },
    {
      "model": "claude-haiku-4-5",
      "score": 0.99,
      "passed": true,
      "grade": "A",
      "reasoning": "The agent successfully created a perfect Hello World script meeting all technical requirements with excellent engineering judgment. The solution is appropriately scoped, idiomatic Python, and clean with no unnecessary artifacts. Nearly flawless execution across all categories achieves near-maximum score.",
      "judge_number": 3
    }
  ],
  "workspace_path": "/home/mvillmow/fullruns/test001-dryrun/2026-01-20T06-13-07-test-001/T3/01/run_01/workspace",
  "logs_path": "/home/mvillmow/fullruns/test001-dryrun/2026-01-20T06-13-07-test-001/T3/01/run_01/agent",
  "command_log_path": "/home/mvillmow/fullruns/test001-dryrun/2026-01-20T06-13-07-test-001/T3/01/run_01/agent/command_log.json",
  "criteria_scores": {}
}
