{
  "run_number": 1,
  "exit_code": 0,
  "token_stats": {
    "input_tokens": 25,
    "output_tokens": 558,
    "cache_creation_tokens": 23266,
    "cache_read_tokens": 91477
  },
  "tokens_input": 91502,
  "tokens_output": 558,
  "cost_usd": 0.1273926,
  "duration_seconds": 207.346919,
  "agent_duration_seconds": 29.340583,
  "judge_duration_seconds": 178.006336,
  "judge_score": 0.9700000000000001,
  "judge_passed": true,
  "judge_grade": "A",
  "judge_reasoning": "The agent successfully created a minimal, idiomatic hello.py script that meets all functional requirements. The solution is exemplary for a Hello World task: a single line of code that prints exactly 'Hello, World!' and exits with code 0. Minor deduction for cache artifacts (.ruff_cache, .pytest_cache) remaining in workspace, though these are typically gitignored and may have been created by the build pipeline rather than the agent.",
  "judges": [
    {
      "model": "claude-opus-4-5-20251101",
      "score": 0.95,
      "passed": true,
      "grade": "A",
      "reasoning": "The agent successfully created a minimal, idiomatic hello.py script that meets all functional requirements. The solution is exemplary for a Hello World task: a single line of code that prints exactly 'Hello, World!' and exits with code 0. Minor deduction for cache artifacts (.ruff_cache, .pytest_cache) remaining in workspace, though these are typically gitignored and may have been created by the build pipeline rather than the agent.",
      "judge_number": 1
    },
    {
      "model": "claude-sonnet-4-5-20250929",
      "score": 0.96,
      "passed": true,
      "grade": "A",
      "reasoning": "The agent successfully completed the Hello World task with a simple, idiomatic implementation that meets all functional requirements. The script executes correctly, produces exact output, and demonstrates appropriate proportionality. Minor deduction for leaving .ruff_cache and .pytest_cache directories in the workspace, though these are build artifacts that should have been ignored.",
      "judge_number": 2
    },
    {
      "model": "claude-haiku-4-5",
      "score": 1.0,
      "passed": true,
      "grade": "S",
      "reasoning": "The agent delivered exceptional work that perfectly satisfies all requirements with zero unnecessary complexity. The hello.py script is implemented with ideal minimalism (1 line of code), passes all functional and quality checks, and demonstrates superior engineering judgment in not over-engineering a trivial task. This solution exemplifies the appropriate scope and clarity expected for Hello World implementations.",
      "judge_number": 3
    }
  ],
  "workspace_path": "/home/mvillmow/fullruns/test001-dryrun/2026-01-20T06-13-07-test-001/T1/01/run_01/workspace",
  "logs_path": "/home/mvillmow/fullruns/test001-dryrun/2026-01-20T06-13-07-test-001/T1/01/run_01/agent",
  "command_log_path": "/home/mvillmow/fullruns/test001-dryrun/2026-01-20T06-13-07-test-001/T1/01/run_01/agent/command_log.json",
  "criteria_scores": {}
}
